{
  "schema_version": "npc.worker-pack/v1",
  "pack_id": "dev.worker.llamacpp",
  "display_name": "llama.cpp LLM deterministic stub",
  "development_stub": true,
  "bundles_third_party": false,
  "installation_owner": "model_manager",
  "protocol": { "version": "1.0", "encodings": ["length_delimited_json", "length_delimited_protobuf"], "transports": ["stdio", "supervisor_created_named_pipe"], "max_frame_bytes": 1048576, "network_access": false },
  "worker": { "id": "worker-llamacpp-stub", "kind": "llm", "engine": "llama.cpp-compatible-contract" },
  "capabilities": { "input_modalities": ["text", "chat_messages"], "output_modalities": ["text", "tokens", "usage"], "compute_backends": ["cpu", "cuda", "vulkan"], "streaming_output": true, "cancellation": true, "network_access": false, "experimental": false, "structured_output": true },
  "resource_estimate": { "idle_ram_mib": 32, "loaded_ram_mib": 48, "peak_ram_mib": 64, "loaded_vram_mib": 0, "peak_vram_mib": 0, "cpu_threads_recommended": 1, "concurrent_requests": 1, "estimate_class": "deterministic_stub_ceiling", "evidence": "Conservative fixture-process scheduling ceiling; not a model benchmark." },
  "development": { "entrypoint": "workers/stubs/worker.py", "default_model_id": "fixture.llm.echo-v1", "purpose": "orchestration_and_protocol_testing_only" },
  "production_pack_requirements": { "third_party_payloads_bundled_here": false, "installed_by": "model_manager", "required_artifact_roles": ["signed_worker_binary", "pinned_llamacpp_runtime", "verified_gguf_model", "tokenizer_metadata", "license_and_attribution"], "activation_gates": ["sha256_and_signature", "runtime_abi", "hardware_compatibility", "license_review", "self_test"] }
}
